metric,source,unit,definition,evidence_level,allowed_use,forbidden_use
shared input route load,CNN packet CSV,packets or wire bits per directed XY edge,Each packet is projected over the frozen dimension-order XY path.,Exact input projection,Visualize offered spatial demand shared by STAGE and BookSim2.,"Do not call it observed queue occupancy, congestion, or simulator latency."
BookSim2 packet latency,terminal packet_delivery.csv,BookSim2 native cycles,arrival_cycle minus release/injection cycle from the finite-trace adapter.,Numerical descriptive,Show BookSim2 temporal backlog and native latency distribution.,Do not subtract it from STAGE packet cycles as an accuracy error.
STAGE microbench event timeline,noc_cycle_timeline.csv,STAGE cycles and typed events,"Committed PacketInjection, BufferOccupancy, Arbitration, Stall, LinkTransfer, and delivery events.",Exact STAGE trace,Trace packet/stall causal paths for supported registered cases.,Do not generalize unsupported capacity-release cases.
STAGE/SCALE-Sim timing,independent 4x4 WS hold-out runs,tool-native cycles,Total cycles produced independently from shared high-level dimensions and mapping contract.,Trend,Compare scaling direction and bounded trend on registered hold-outs.,Do not claim exact schedule or per-cycle equivalence.
simulation wall time,runtime summary and scalability raw results,wall-clock seconds,Measured host execution duration; separate from simulated cycles.,Measured wall clock,Report tool/runtime cost under the recorded host and trace mode.,Do not mix wall-clock seconds with modeled hardware cycles.
